{"authority":{"aggregation_authorized":false,"attempts_per_task_id":1,"authorized_batch_count":6,"authorized_batch_ids":["M4.1-BATCH-NUC","M4.1-BATCH-MEC","M4.1-BATCH-ELE","M4.1-BATCH-AUT","M4.1-BATCH-COM","M4.1-BATCH-MPH"],"authorized_task_count":60,"authorized_task_ids":["M4.1-ELE-B-A2","M4.1-ELE-B-A1","M4.1-MEC-A-N","M4.1-NUC-A-F","M4.1-NUC-B-A1","M4.1-MPH-B-F","M4.1-MEC-A-A1","M4.1-COM-B-F","M4.1-MEC-B-F","M4.1-ELE-A-A1","M4.1-NUC-A-A1","M4.1-ELE-A-N","M4.1-COM-B-A1","M4.1-MPH-A-N","M4.1-MEC-A-A3","M4.1-AUT-B-A2","M4.1-MEC-B-A3","M4.1-AUT-B-A3","M4.1-MPH-A-A2","M4.1-ELE-A-F","M4.1-NUC-B-A3","M4.1-COM-B-A2","M4.1-MPH-A-A1","M4.1-AUT-A-A3","M4.1-AUT-B-A1","M4.1-COM-A-N","M4.1-NUC-A-A2","M4.1-COM-B-N","M4.1-COM-A-A3","M4.1-ELE-B-A3","M4.1-ELE-B-N","M4.1-AUT-A-A1","M4.1-AUT-B-N","M4.1-NUC-B-F","M4.1-MPH-A-A3","M4.1-AUT-A-A2","M4.1-NUC-A-N","M4.1-MPH-B-A2","M4.1-ELE-B-F","M4.1-MEC-B-A1","M4.1-MEC-B-A2","M4.1-COM-B-A3","M4.1-AUT-B-F","M4.1-NUC-B-A2","M4.1-NUC-A-A3","M4.1-MPH-A-F","M4.1-COM-A-A2","M4.1-COM-A-F","M4.1-MPH-B-N","M4.1-ELE-A-A3","M4.1-AUT-A-N","M4.1-COM-A-A1","M4.1-MEC-A-A2","M4.1-MEC-A-F","M4.1-MPH-B-A1","M4.1-MEC-B-N","M4.1-ELE-A-A2","M4.1-MPH-B-A3","M4.1-AUT-A-F","M4.1-NUC-B-N"],"blind_mapping_access_authorized":false,"closure_authorized":false,"followup_message_authorized":false,"fresh_contexts_authorized":60,"fresh_execution_authorized":true,"independent_finalizations_authorized":60,"judge_execution_authorized":false,"repair_authorized":false,"result_write_root_prefix":"evals/m4/results/m4.1","result_writes_authorized":true,"retry_authorized":false,"threshold_claim_authorized":false},"authorization_token":"sha256:b5fe4ee85f59935a32d6b1a93cf7a5ec64fdbb51348fab624d83c4292f646109","batch_policy":{"batch_order":["M4.1-BATCH-NUC","M4.1-BATCH-MEC","M4.1-BATCH-ELE","M4.1-BATCH-AUT","M4.1-BATCH-COM","M4.1-BATCH-MPH"],"failure_preservation_required":true,"later_batches_mutable_after_observation":false,"stop_current_batch_on_infrastructure_or_protocol_failure":true,"successor_revision_required_after_failure":true,"tasks_per_batch":10},"consumption":{"authorization_token_status":"UNCONSUMED","claim_consumes_entire_matrix_authorization":true,"claim_count":0,"launch_claim_must_be_absent":true,"launch_claim_path":"evals/m4/execution/m4.1/launch-claim.json","partial_or_failed_matrix_requires_new_revision":true},"does_not_authorize":["a second attempt for any M4.1 task ID","a retry, repair, continuation, or follow-up message","a task outside the frozen 60-task M4.1 matrix","cross-task or cross-arm result visibility","judge execution, blind-map access, or unblinding","result aggregation or acceptance-threshold claims","changes to cases, prompts, variants, rubric, thresholds, or randomization","M4 closure, M5, an experiment, simulation, training run, deployment, or control action"],"execution_helper":{"git_blob_oid":"730b0d50d61abb2e323398ae507d7d5f50470a19","minimum_windows_powershell_version":"5.1","path":"evals/m4/execution/prepare_m4_1_request_bundles.ps1","raw_sha256":"ab0f82438d28a8b704075772889028e4f0eeab10eb1ec294df7fc3d0eb06d2e0","read_only":true,"request_binding_count":60},"execution_surface":{"cross_task_result_visibility":false,"environment":"worktree","project_id":"ff35b25f-4644-41c8-9073-74c697559439","project_is_git_repository":true,"project_label":"engineering-research-copilot","starting_branch":"codex/m4-cross-engineering-forward-evaluation-m4.1-one-shot-authorization","task_context_isolation":"ONE_NEW_THREAD_PER_TASK_ID","tool":"codex_app.create_thread"},"milestone":"M4","model_binding":{"configured_default_required":true,"exact_model_id":"gpt-5.6-sol","model_argument_policy":"OMIT_AND_VERIFY_CONFIGURED_DEFAULT","model_context_window_tokens":1050000,"model_max_output_tokens":128000,"official_model_reference":"https://developers.openai.com/api/docs/models/gpt-5.6-sol","reasoning_effort":"max","thinking_argument_policy":"OMIT_AND_VERIFY_CONFIGURED_DEFAULT"},"prelaunch_counters":{"authorized_tasks":0,"created_contexts":0,"dispatched_tasks":0,"finalizations":0,"judge_scores":0,"repairs":0,"results_observed":0,"retries":0,"unauthorized_side_effects":0},"preparation_baseline":{"audit_status":"PREPARED_NOT_AUTHORIZED","ci_conclusion":"success","ci_run_id":31248424046,"head":"fedc5cdeebd7a2943afeb6767d39841305c55444","manifest_git_blob_oid":"42a10d36e4d64ab98aa724114b904001107f557d","manifest_path":"evals/m4/revisions/m4.1/preparation-manifest.json","manifest_raw_sha256":"d66ad9d513d8e64307f9a1553242d9b7d840ea5432d084b06d86707c1b4c2b61"},"review":{"decision":"AUTHORIZE_M4_1_GATE_IV_ONE_SHOT_MATRIX","finding_count":0,"git_blob_oid":"e38f3fc2305efefb070e3be20413c55156e8b186","path":"evals/m4/authorization/m4.1/gate-iv-review.json","raw_sha256":"5eb1279ae08c8d8fd8f0f7feb0f3207607b8b8c4cbad7155c844bff6fb4aa3b0","schema_version":"m4.1-gate-iv-independent-review-v1","status":"PASSED"},"revision":"M4.1","schema_version":"m4.1-execution-authorization-v1","status":"AUTHORIZED_UNCONSUMED"}
